{
  "meta": {
    "schema_version": "1.1.0",
    "language": "zh-CN",
    "toolchain": "v4.27.0",
    "last_updated": "2026-02-14",
    "policy": [
      "json_ssot_only",
      "markdown_generated_only",
      "concept_first_layout",
      "compatible_migration_with_aliases",
      "append_first_and_logged_deletions",
      "no_external_dependency_integration_phase",
      "single_source_truth_docs_ssot_registry",
      "derived_markdown_generated_via_sync_docs",
      "legacy_book_modules_as_compatibility_adapters",
      "three_repo_collaboration",
      "repo_scope_skills_first",
      "mcp_lean_lsp_uvx_enabled",
      "placeholder_policy_phase1_soft_then_phase2_hard"
    ]
  },
  "decisions": [
    {
      "date": "2026-02-13",
      "decision": "Lean 包名采用 `MLTheory`（CamelCase），GitHub 仓库名采用 `mltheory-lean`。",
      "status": "locked",
      "impact": "统一 import 体验并保持仓库命名可读性。"
    },
    {
      "date": "2026-02-13",
      "decision": "项目初始化流程采用 mathlib 模板：`lake +leanprover-community/mathlib4:lean-toolchain new MLTheory math`，并执行 `lake exe cache get` + `lake build`。",
      "status": "locked",
      "impact": "保证 mathlib 依赖与 toolchain 一致，降低首次构建成本。"
    },
    {
      "date": "2026-02-13",
      "decision": "主题层模块固定为 `Probability/Statistics/OR/Learning/AI/LLM`。",
      "status": "locked",
      "impact": "建立长期稳定的公共库边界，避免后续重命名破坏下游。"
    },
    {
      "date": "2026-02-13",
      "decision": "HDP（Vershynin）采用“混合层”：主题模块承载实现，`HDP/Ch01..Ch09` 作为章节索引（re-export）。",
      "status": "locked",
      "impact": "兼顾按主题复用与按章节检索。"
    },
    {
      "date": "2026-02-13",
      "decision": "机器学习高级理论（SLT）策略：`v0.1` 先占位后接入。",
      "status": "locked",
      "impact": "先稳住基础依赖，降低首版复杂度与版本风险。"
    },
    {
      "date": "2026-02-13",
      "decision": "Durrett 覆盖基线采用第 5 版（I–XI 章）并先建占位模块（`CLTBridge/Brownian/CTMC/...`）。",
      "status": "locked",
      "impact": "明确概率主线补漏范围，支持分阶段迭代。"
    },
    {
      "date": "2026-02-13",
      "decision": "本阶段保持现有 toolchain（4.27.x），不立即接入外部仓库作为硬依赖。",
      "status": "locked",
      "impact": "避免版本漂移导致构建不稳定。"
    },
    {
      "date": "2026-02-13",
      "decision": "外部候选仓库仅登记不集成：`RemyDegenne/CLT`、`RemyDegenne/brownian-motion`、`BasharHamade12/MarkovChain_Formalisation_Lean`。",
      "status": "active",
      "impact": "为后续补齐 CLT/Brownian/Markov chain 留出路线图。"
    },
    {
      "date": "2026-02-13",
      "decision": "文档治理采用“中文 + 多文档索引制”，并固定 `INDEX/DecisionLog/ModuleCatalog/GapLedger/books/*` 结构。",
      "status": "locked",
      "impact": "后续扩展到多本书时可持续维护。"
    },
    {
      "date": "2026-02-13",
      "decision": "增加 `AGENTS.md` 作为仓库级执行规范；要求“新信息必回写文档系统”，并执行“非随意删除、删除必须留痕”。",
      "status": "locked",
      "impact": "后续所有任务都有统一约束，降低信息丢失和误删风险。"
    },
    {
      "date": "2026-02-13",
      "decision": "新增书籍覆盖基线：Lattimore & Szepesvari《Bandit Algorithms》，采用 Part I-VII 组织并引入 `MLTheory.Bandits.*` 模块族。",
      "status": "locked",
      "impact": "建立 bandit/在线决策主线，补齐与现有概率/学习模块的连接。"
    },
    {
      "date": "2026-02-13",
      "decision": "Bandit 当前策略：先建定义与章节索引占位，不立即引入外部依赖（GitHub 检索暂未发现成熟 Lean4 bandit 专项仓库）。",
      "status": "active",
      "impact": "降低初期实现风险，同时保留后续并入外部成果的空间。"
    },
    {
      "date": "2026-02-13",
      "decision": "新增书籍覆盖基线：Hazan《Introduction to Online Convex Optimization (Second Edition)》，采用“优先复用已有模块 + 最小新增 OCO 模块”策略。",
      "status": "locked",
      "impact": "控制模块冗余，确保 OCO 与 Bandit/Convex/Probability 模块一致协作。"
    },
    {
      "date": "2026-02-13",
      "decision": "执行全量文档去重：移除各书覆盖文档中的重复治理说明，统一以 `INDEX.md` + 模板文档作为规则单一来源。",
      "status": "locked",
      "impact": "降低文档冗余，避免多处规则漂移。"
    },
    {
      "date": "2026-02-13",
      "decision": "第二轮去重：移除书籍覆盖文档中与 `ModuleCatalog.md` 重复的模块长列表，保留“章节映射 + 缺口动作 + 证据”三要素。",
      "status": "locked",
      "impact": "将模块清单收敛到单一事实源（`ModuleCatalog.md`），降低跨文档维护成本。"
    },
    {
      "date": "2026-02-13",
      "decision": "新增书籍覆盖基线：Mohri-Rostamizadeh-Talwalkar《Foundations of Machine Learning (2nd)》，采用“复用既有 Learning/OCO/Bandit 模块 + 最小新增缺口模块”策略。",
      "status": "locked",
      "impact": "在不扩散模块命名的前提下纳入 FoML2 主线，保持跨书一致性。"
    },
    {
      "date": "2026-02-13",
      "decision": "FoML2 信息源限定为官方 MIT Press 页面与官方 TOC PDF；Lean 生态状态以 GitHub API 检索结果为准，不使用未验证二手摘要。",
      "status": "locked",
      "impact": "降低目录与生态判断误差，满足“不可编造”约束。"
    },
    {
      "date": "2026-02-13",
      "decision": "实施 FoML2 第一批代码骨架：`Ch02_PACLearning`、`Ch03_RademacherVCDimension`、`Ch04_ModelSelection` 三个占位模块已创建并接入 `MLTheory` 入口。",
      "status": "locked",
      "impact": "FoML2 从“纯文档规划”进入“可编译占位实现”阶段，便于后续逐章填充定理。"
    },
    {
      "date": "2026-02-13",
      "decision": "网络超时场景采用 `terminal-vpn-proxy`（`run_with_proxy.sh`）拉取 mathlib cache，并完成 `lake build`。",
      "status": "active",
      "impact": "形成可复用的网络故障处理路径，降低后续依赖拉取失败风险。"
    },
    {
      "date": "2026-02-13",
      "decision": "实施 FoML2 第二批代码骨架：`Ch05_SupportVectorMachines`、`Ch06_KernelMethods` 已创建并接入 `MLTheory.Books.FoML2` 入口。",
      "status": "locked",
      "impact": "FoML2 的 SVM/Kernel 主线已进入可编译占位阶段，后续可直接叠加 primal-dual 与 representer theorem 证明。"
    },
    {
      "date": "2026-02-13",
      "decision": "新增书籍覆盖基线：Sutton-Barto《Reinforcement Learning: An Introduction (2nd)》，采用“复用 Bandits/OCO/Learning 模块 + 最小新增 RL 模块族”策略。",
      "status": "locked",
      "impact": "在不重复造轮子的前提下纳入 RL 主线，并与既有书籍共享术语与证明接口。"
    },
    {
      "date": "2026-02-13",
      "decision": "RL2 目录证据优先使用作者官方书页与 MIT Press eTextbook TOC；Lean 生态状态以 GitHub API 检索结果为准。",
      "status": "locked",
      "impact": "降低章节映射与生态判断误差，满足“不可编造”约束。"
    },
    {
      "date": "2026-02-13",
      "decision": "实施 RL2 第一批代码骨架：`Ch03_MDP`、`Ch04_DynamicProgramming` 已创建并接入 `MLTheory.Books.SuttonBartoRL2` 入口。",
      "status": "locked",
      "impact": "RL2 从纯文档规划进入可编译占位实现阶段，后续可直接追加 Bellman/DP 收敛定理陈述。"
    },
    {
      "date": "2026-02-13",
      "decision": "文档检索与展示采用 JSON 单一事实源：`docs/ssot/registry.json`；Markdown 文档全部改为派生文件。",
      "status": "locked",
      "impact": "避免多处手工维护导致漂移，支持 Codex/jq/python 稳定检索与自动更新。"
    },
    {
      "date": "2026-02-13",
      "decision": "新增 `tools/docs/validate_ssot.py` 与 `tools/docs/sync_docs.py`，文档维护流程固定为“先改 SSOT，再生成派生文档”。",
      "status": "locked",
      "impact": "建立可重复执行的文档契约校验与生成流水线。"
    },
    {
      "date": "2026-02-13",
      "decision": "代码组织改为概念优先分层：`Core/Methods/Applications` 承载定义与方法，`Books/*` 收敛为兼容适配层。",
      "status": "locked",
      "impact": "实现跨书复用与稳定导入路径，同时不破坏既有章节 import。"
    },
    {
      "date": "2026-02-13",
      "decision": "接入本地 Lean 专用技能：从同级仓库 `lean-proof-skills` 安装 `lean4` skill 到 `~/.codex/skills/lean4`，后续 Lean 任务优先按该技能流程执行。",
      "status": "active",
      "impact": "统一 Lean 证明与排错流程，降低 tactic 试错与检索成本，提高 mathlib/LSP 使用一致性。"
    },
    {
      "date": "2026-02-13",
      "decision": "三仓协同关系锁定：`paper-template` 作为运行入口，`lean-proof-skills` 作为 skillpack 父仓（含 `lean4` 与 `ml-paper-workflow`），`MLTheory` 作为 Lake `git + tag` 依赖。",
      "status": "locked",
      "impact": "明确职责边界并支持独立升级/回滚。"
    },
    {
      "date": "2026-02-13",
      "decision": "模板仓技能接入方式锁定：`.agents/skillpacks/lean-proof-skills` 使用 submodule；`.agents/skills/lean4` 与 `.agents/skills/ml-paper-workflow` 使用 facade symlink。",
      "status": "locked",
      "impact": "确保 Codex 在 repo-scope 优先加载项目技能，减少全局配置漂移。"
    },
    {
      "date": "2026-02-13",
      "decision": "Lean LSP 统一接入策略锁定为 `codex mcp add lean-lsp -- uvx lean-lsp-mcp`，全局技能仅作兜底，正式链路以模板仓 repo-scope 配置为准。",
      "status": "active",
      "impact": "提升交互式证明与检索稳定性，并降低环境差异。"
    },
    {
      "date": "2026-02-13",
      "decision": "占位治理采用两阶段门禁：Phase 1 允许 `Applications/Books/Legacy` 占位但 `Core/Methods` 必须为 0；Phase 2 在 CI 对 `Core/Methods` 占位回归硬失败。",
      "status": "active",
      "impact": "在保证迭代速度的同时，持续收敛核心层证明质量。"
    },
    {
      "date": "2026-02-13",
      "decision": "补齐旧路径兼容层：新增 `MLTheory.Probability/Statistics/OR/Learning/AI/LLM/OCO/RL/Bandits/HDP` 与 `Concentration/Optimization/InfoTheory` 薄封装入口，避免历史 import 断裂。",
      "status": "active",
      "impact": "新旧导入路径可并行编译，迁移成本可控。"
    },
    {
      "date": "2026-02-13",
      "decision": "CI 增加导入回归冒烟：`Eval/ImportSmoke.lean` 同时验证分层路径与兼容路径可编译。",
      "status": "active",
      "impact": "防止后续重构破坏兼容入口。"
    },
    {
      "date": "2026-02-14",
      "decision": "新增术语白话表 `docs/Glossary.md` 并纳入自动生成流程，用于统一解释 JSON/SSOT/Lean/CI 相关术语。",
      "status": "active",
      "impact": "减少沟通黑话，确保用户与 Codex 对关键概念的语义一致。"
    },
    {
      "date": "2026-02-14",
      "decision": "删除 `AGENT.md` 兼容入口并将唯一规范入口统一为 `AGENTS.md`；无语义损失，相关约束已并入主规范文件。",
      "status": "locked",
      "impact": "减少重复入口与维护歧义，避免规范分叉。"
    },
    {
      "date": "2026-02-14",
      "decision": "执行“工具优先重排”：MLTheory 主库只承载通用学习理论工具（Rademacher/Contraction/PAC+Concentration），题目专用定理留在 paper-template。",
      "status": "locked",
      "impact": "避免把单题建模污染共享库接口，提升跨论文复用性。"
    },
    {
      "date": "2026-02-14",
      "decision": "完成外部库审计：`auto-res/lean-rademacher`（Lean 4.27.0-rc1，MIT）可作为高优先参考；`YuanheZ/lean-stat-learning-theory`（Lean 4.27.0-rc1，license 未声明）暂不作为直接依赖。",
      "status": "active",
      "impact": "形成“可复用声明名 + 许可证 + 直接依赖可行性”的审计基线，后续接入可追溯。"
    },
    {
      "date": "2026-02-14",
      "decision": "外部库二次审计补充：`google/formal-ml` 为 Lean3 体系（含 PAC/VC 文件但非 Lean4 toolchain），`mahi97/ml-proofs-lean4` 偏优化方向且与当前 Rademacher/PAC 工具主链不匹配，均暂不纳入直接依赖。",
      "status": "active",
      "impact": "补全“优先现成库”审计覆盖面，并避免把版本/主题不匹配仓库误接入主链。"
    },
    {
      "date": "2026-02-14",
      "decision": "确认 `banr1/tailored-lean-stat-learning-theory` 与 `YuanheZ/lean-stat-learning-theory` 当前提交一致（同 HEAD），按同一候选去重管理。",
      "status": "active",
      "impact": "减少候选重复记录，避免审计结果分叉。"
    },
    {
      "date": "2026-02-14",
      "decision": "锁定“完全形式化（严格版）”完成标准：Theorem42/43 最终入口不暴露中间桥接接口，且以 Lean 编译通过与签名门禁作为验收条件。",
      "status": "locked",
      "impact": "为后续实现提供统一的终态定义与自动化验收口径。"
    },
    {
      "date": "2026-02-14",
      "decision": "Theorem42 严格版主路线锁定为 Stone-Weierstrass：先用可分离点子代数建立 epsilon 逼近，再回灌到二层参数化接口。",
      "status": "locked",
      "impact": "优先复用 mathlib 成熟定理，减少重复造轮子并提高证明稳定性。"
    },